{
  "schema_version": "2.0.0",
  "content_version": "0.3.2",
  "framework_id": "cfw_sg_seab_h2_chemistry_9476_2026_outcomes",
  "curriculum_id": "cur_sg_seab_h2_chemistry_9476_2026",
  "curriculum_kind": "examination_syllabus",
  "title": "Singapore-Cambridge GCE Advanced Level H2 Chemistry 9476 outcome coverage",
  "title_zh": "新加坡剑桥 GCE A-Level H2 化学 9476（2026）学习成果级覆盖",
  "jurisdiction": "SG",
  "subject": "Chemistry",
  "education_stage": "pre_university",
  "levels": [
    {
      "level_id": "h2_9476",
      "label": "H2 Chemistry 9476",
      "label_zh": "H2 化学 9476"
    }
  ],
  "languages": [
    "en",
    "zh-CN"
  ],
  "valid_from": "2026-01-01",
  "valid_to": null,
  "source_ids": [
    "src_sg_seab_h2_chemistry_9476_2026"
  ],
  "requirement_granularity": "outcome",
  "review_status": "approved",
  "changelog": [
    {
      "version": "0.3.0",
      "date": "2026-07-19",
      "summary_zh": "用官方 194 项字母编号学科成果和 7 项跨主题实践取代 13 个主题导航映射。"
    },
    {
      "version": "0.3.1",
      "date": "2026-10-25",
      "summary_zh": "按 2026-10-25 官方来源复核更新证据定位（中国课标迁至 2025 日常修订版、新加坡页码校正），状态保持 needs_review。"
    },
    {
      "version": "0.3.2",
      "date": "2026-10-25",
      "summary_zh": "完成联网复核与人工批准。"
    }
  ],
  "scope_exclusions": [
    {
      "scope": "atomic orbital wave functions",
      "rationale_zh": "Topic 1(g) 明确不要求波函数知识。",
      "evidence_refs": [
        {
          "source_id": "src_sg_seab_h2_chemistry_9476_2026",
          "locator": "PDF pp.13-35, explicit bracketed scope statements"
        }
      ]
    },
    {
      "scope": "quantitative electronegativity",
      "rationale_zh": "Topic 2(f) 只要求定性使用电负性。",
      "evidence_refs": [
        {
          "source_id": "src_sg_seab_h2_chemistry_9476_2026",
          "locator": "PDF pp.13-35, explicit bracketed scope statements"
        }
      ]
    },
    {
      "scope": "crystallographic unit cells",
      "rationale_zh": "Topic 2(l) 明确不要求晶胞概念。",
      "evidence_refs": [
        {
          "source_id": "src_sg_seab_h2_chemistry_9476_2026",
          "locator": "PDF pp.13-35, explicit bracketed scope statements"
        }
      ]
    },
    {
      "scope": "Kp-Kc conversion relationship",
      "rationale_zh": "Topic 9(d) 明确不要求 Kp 与 Kc 的换算关系。",
      "evidence_refs": [
        {
          "source_id": "src_sg_seab_h2_chemistry_9476_2026",
          "locator": "PDF pp.13-35, explicit bracketed scope statements"
        }
      ]
    },
    {
      "scope": "integrated rate equations",
      "rationale_zh": "Topic 8(b) 明确不要求积分速率方程。",
      "evidence_refs": [
        {
          "source_id": "src_sg_seab_h2_chemistry_9476_2026",
          "locator": "PDF pp.13-35, explicit bracketed scope statements"
        }
      ]
    },
    {
      "scope": "quantitative entropy from standard entropy tables",
      "rationale_zh": "Topic 7 不要求定量熵处理或由标准熵计算反应熵。",
      "evidence_refs": [
        {
          "source_id": "src_sg_seab_h2_chemistry_9476_2026",
          "locator": "PDF pp.13-35, explicit bracketed scope statements"
        }
      ]
    },
    {
      "scope": "quadratic equilibrium and weak-acid calculations",
      "rationale_zh": "Topics 9–10 不要求需要解二次方程的平衡计算。",
      "evidence_refs": [
        {
          "source_id": "src_sg_seab_h2_chemistry_9476_2026",
          "locator": "PDF pp.13-35, explicit bracketed scope statements"
        }
      ]
    },
    {
      "scope": "E/Z nomenclature and diastereomer terminology",
      "rationale_zh": "Topic 11.2 不要求 E/Z 命名和非对映体术语。",
      "evidence_refs": [
        {
          "source_id": "src_sg_seab_h2_chemistry_9476_2026",
          "locator": "PDF pp.13-35, explicit bracketed scope statements"
        }
      ]
    },
    {
      "scope": "detailed enzyme protein structure and denaturation",
      "rationale_zh": "Topic 8(k) 不要求蛋白质结构层级与变性细节。",
      "evidence_refs": [
        {
          "source_id": "src_sg_seab_h2_chemistry_9476_2026",
          "locator": "PDF pp.13-35, explicit bracketed scope statements"
        }
      ]
    },
    {
      "scope": "mechanistic ozone-depletion chemistry",
      "rationale_zh": "Topic 11.5(e) 不要求 CFC 与 HCFC 破坏臭氧层的机理细节。",
      "evidence_refs": [
        {
          "source_id": "src_sg_seab_h2_chemistry_9476_2026",
          "locator": "PDF pp.13-35, explicit bracketed scope statements"
        }
      ]
    },
    {
      "scope": "industrial electrolysis technical details",
      "rationale_zh": "Topic 12(o) 不要求工业过程技术细节。",
      "evidence_refs": [
        {
          "source_id": "src_sg_seab_h2_chemistry_9476_2026",
          "locator": "PDF pp.13-35, explicit bracketed scope statements"
        }
      ]
    },
    {
      "scope": "relative ligand-field strength ordering",
      "rationale_zh": "Topic 13(l) 不要求配体场强弱序列。",
      "evidence_refs": [
        {
          "source_id": "src_sg_seab_h2_chemistry_9476_2026",
          "locator": "PDF pp.13-35, explicit bracketed scope statements"
        }
      ]
    }
  ],
  "requirements": [
    {
      "requirement_id": "req_sg_h2_chemistry_9476_2026_o_1_a",
      "code": "1.a",
      "title": "Atomic Structure",
      "title_zh": "原子结构",
      "summary_zh": "比较质子、中子和电子的相对质量与电荷",
      "requirement_type": "knowledge",
      "level_id": "h2_9476",
      "cognitive_processes": [
        "understand",
        "apply"
      ],
      "parent_requirement_id": null,
      "evidence_refs": [
        {
          "source_id": "src_sg_seab_h2_chemistry_9476_2026",
          "locator": "PDF p.13, topic 1 Atomic Structure, outcome (a)"
        }
      ],
      "review_status": "approved"
    },
    {
      "requirement_id": "req_sg_h2_chemistry_9476_2026_o_1_b",
      "code": "1.b",
      "title": "Atomic Structure",
      "title_zh": "原子结构",
      "summary_zh": "由带电性推断质子、中子和电子束在电场中的偏转",
      "requirement_type": "knowledge",
      "level_id": "h2_9476",
      "cognitive_processes": [
        "understand",
        "apply"
      ],
      "parent_requirement_id": null,
      "evidence_refs": [
        {
          "source_id": "src_sg_seab_h2_chemistry_9476_2026",
          "locator": "PDF p.13, topic 1 Atomic Structure, outcome (b)"
        }
      ],
      "review_status": "approved"
    },
    {
      "requirement_id": "req_sg_h2_chemistry_9476_2026_o_1_c",
      "code": "1.c",
      "title": "Atomic Structure",
      "title_zh": "原子结构",
      "summary_zh": "说明原子中质量与电荷的分布",
      "requirement_type": "knowledge",
      "level_id": "h2_9476",
      "cognitive_processes": [
        "understand",
        "apply"
      ],
      "parent_requirement_id": null,
      "evidence_refs": [
        {
          "source_id": "src_sg_seab_h2_chemistry_9476_2026",
          "locator": "PDF p.13, topic 1 Atomic Structure, outcome (c)"
        }
      ],
      "review_status": "approved"
    },
    {
      "requirement_id": "req_sg_h2_chemistry_9476_2026_o_1_d",
      "code": "1.d",
      "title": "Atomic Structure",
      "title_zh": "原子结构",
      "summary_zh": "由质子数、核子数和电荷确定原子或离子的质子、中子、电子数",
      "requirement_type": "knowledge",
      "level_id": "h2_9476",
      "cognitive_processes": [
        "understand",
        "apply"
      ],
      "parent_requirement_id": null,
      "evidence_refs": [
        {
          "source_id": "src_sg_seab_h2_chemistry_9476_2026",
          "locator": "PDF p.13, topic 1 Atomic Structure, outcome (d)"
        }
      ],
      "review_status": "approved"
    },
    {
      "requirement_id": "req_sg_h2_chemistry_9476_2026_o_1_e",
      "code": "1.e",
      "title": "Atomic Structure",
      "title_zh": "原子结构",
      "summary_zh": "用质子数、核子数和中子数区分原子核与同位素",
      "requirement_type": "knowledge",
      "level_id": "h2_9476",
      "cognitive_processes": [
        "understand",
        "apply"
      ],
      "parent_requirement_id": null,
      "evidence_refs": [
        {
          "source_id": "src_sg_seab_h2_chemistry_9476_2026",
          "locator": "PDF p.13, topic 1 Atomic Structure, outcome (e)"
        }
      ],
      "review_status": "approved"
    },
    {
      "requirement_id": "req_sg_h2_chemistry_9476_2026_o_1_f",
      "code": "1.f",
      "title": "Atomic Structure",
      "title_zh": "原子结构",
      "summary_zh": "说明 1–3 主量子层及 4s、4p 中 s、p、d 轨道的数目和相对能量",
      "requirement_type": "knowledge",
      "level_id": "h2_9476",
      "cognitive_processes": [
        "understand",
        "apply"
      ],
      "parent_requirement_id": null,
      "evidence_refs": [
        {
          "source_id": "src_sg_seab_h2_chemistry_9476_2026",
          "locator": "PDF p.13, topic 1 Atomic Structure, outcome (f)"
        }
      ],
      "review_status": "approved"
    },
    {
      "requirement_id": "req_sg_h2_chemistry_9476_2026_o_1_g",
      "code": "1.g",
      "title": "Atomic Structure",
      "title_zh": "原子结构",
      "summary_zh": "描述 s、p、d 原子轨道形状；不要求波函数",
      "requirement_type": "knowledge",
      "level_id": "h2_9476",
      "cognitive_processes": [
        "understand",
        "apply"
      ],
      "parent_requirement_id": null,
      "evidence_refs": [
        {
          "source_id": "src_sg_seab_h2_chemistry_9476_2026",
          "locator": "PDF p.13, topic 1 Atomic Structure, outcome (g)"
        }
      ],
      "review_status": "approved"
    },
    {
      "requirement_id": "req_sg_h2_chemistry_9476_2026_o_1_h",
      "code": "1.h",
      "title": "Atomic Structure",
      "title_zh": "原子结构",
      "summary_zh": "由质子数和电荷写出原子与离子的电子排布",
      "requirement_type": "knowledge",
      "level_id": "h2_9476",
      "cognitive_processes": [
        "understand",
        "apply"
      ],
      "parent_requirement_id": null,
      "evidence_refs": [
        {
          "source_id": "src_sg_seab_h2_chemistry_9476_2026",
          "locator": "PDF p.13, topic 1 Atomic Structure, outcome (h)"
        }
      ],
      "review_status": "approved"
    },
    {
      "requirement_id": "req_sg_h2_chemistry_9476_2026_o_1_i",
      "code": "1.i",
      "title": "Atomic Structure",
      "title_zh": "原子结构",